[
  {
    "id": "area:country:nigeria",
    "type": "COUNTRY",
    "name": "Nigeria",
    "officialName": "Federal Republic of Nigeria",
    "code": "NG",
    "country": "NG",
    "parentId": null,
    "status": "ACTIVE",
    "sources": [
      {
        "sourceId": "source:constitution:1999-as-amended",
        "confidence": "HIGH"
      }
    ],
    "quality": {
      "status": "SOURCE_MATCHED",
      "verificationLevel": "SOURCE_MATCHED",
      "lastVerifiedAt": null,
      "issues": []
    },
    "metadata": {}
  }
]
